{
    "key": "the_true_wild_west",
    "name": "The True Wild West",
    "items": [51008000, 51010000, 51009000, 50992000],
    "sets": ["2018_sale_set_golden_1"],
    "from": "2018-04-26 00:00:00",
    "to": "2018-04-28 00:00:00",
    "year": 2018,
    "forum_url": "https://forum.the-west.net/index.php?threads/the-true-wild-west.57680/"
}
