{
    "key": "octoberfest",
    "sets": [
        "oktoberfest_2021_set_10",
        "oktoberfest_2021_set_9",
        "oktoberfest_2021_set_8",
        "oktoberfest_2021_set_7",
        "oktoberfest_2021_set_6",
        "oktoberfest_2021_set_5",
        "oktoberfest_2021_set_4",
        "oktoberfest_2021_set_3",
        "oktoberfest_2021_set_2",
        "oktoberfest_2021_set_1"
    ],
    "year": 2021,
    "tombola": 35,
    "beta_from": "2021-09-07 12:00:00",
    "beta_to": "2021-10-11 11:59:59",
    "forum_url": "https://forum.beta.the-west.net/index.php?threads/oktoberfest-event-2021.4074/#post-40965"
}
