{
    "key": "easter",
    "items": [
        51977000,
        51975000,
        51969000,
        51968000,
        51965000,
        51963000,
        51960000,
        51964000,
        51967000,
        51962000,
        51957000,
        51959000,
        51949000,
        51953000,
        51955000,
        51951000,
        51954000,
        51940000,
        51947000,
        51946000,
        51945000,
        51937000,
        51938000,
        51930000,
        51932000,
        51935000,
        51929000,
        51931000,
        51978000,
        51979000,
        51980000,
        51983000,
        51986000,
        51985000,
        51981000,
        51982000
    ],
    "sets": [
        "easter_2020_set_1",
        "easter_2020_set_2",
        "easter_2020_set_3",
        "easter_2020_set_4",
        "easter_2020_set_5",
        "easter_2020_set_6",
        "easter_2020_set_7",
        "easter_2020_set_8"
    ],
    "from": "2020-04-07 00:00:00",
    "to": "2020-04-30 23:59:59",
    "year": 2020,
    "tombola": 28,
    "beta_from": "2020-03-18 10:00:00",
    "beta_to": "2020-04-24 10:00:00"
}
