{
    "key": "harvest_time",
    "name": "Harvest time",
    "items": [
        51611000,
        51616000,
        51641000,
        51642000,
        51643000,
        51644000,
        51645000,
        51646000,
        51647000,
        51648000,
        51649000,
        51650000
    ],
    "from": "2019-08-22 00:00:00",
    "to": "2019-09-09 00:00:00",
    "year": 2019,
    "quests": [208],
    "forum_url": "https://forum.the-west.net/index.php?threads/harvest-time.58476/"
}
