{
    "key": "octoberfest",
    "items": [
        50207000, 50208000, 50209000, 50211000, 50212000, 50213000, 50214000, 50215000, 50216000, 50217000, 50218000,
        50219000, 50220000, 50221000, 50222000, 50223000, 50224000, 50225000, 50226000, 50227000, 50228000, 50229000,
        50230000, 50231000, 50232000, 50233000, 50234000, 50235000, 50236000, 50237000, 50238000, 50239000, 50240000,
        50241000, 50242000, 50243000, 50244000, 50245000, 50246000, 50247000, 50248000, 50249000, 50250000, 50251000,
        50252000, 50253000, 50254000, 50255000, 50256000, 50257000
    ],
    "sets": [
        "set_oktoberfest_2016_1",
        "set_oktoberfest_2016_1_weapon",
        "set_oktoberfest_2016_2",
        "set_oktoberfest_2016_2_weapon",
        "set_oktoberfest_2016_3",
        "set_oktoberfest_2016_3_weapon",
        "set_oktoberfest_2016_4",
        "set_oktoberfest_2016_5"
    ],
    "from": "2016-09-14 10:00:00",
    "to": "2017-10-06 23:59:59",
    "year": 2016,
    "quests": [155],
    "tombola": 15
}
