{
    "key": "civil_war_sale",
    "name": "Civil War Sale",
    "items": [
        51399000,
        51400000,
        51401000,
        51402000,
        51403000,
        51404000,
        51405000,
        51406000,
        51407000,
        51408000,
        51409000
    ],
    "sets": ["spring_1_2019", "spring_2_2019"],
    "from": "2019-04-14 12:00:00",
    "to": "2019-04-16 12:00:00",
    "year": 2019,
    "forum_url": "https://forum.the-west.net/index.php?threads/civil-war.58359/#post-769019"
}
