{
    "key": "independence",
    "name": "Independence Day Event",
    "year": 2026,
    "from": "2026-07-01 12:00:00",
    "to": "2026-07-21 12:00:00",
    "beta_from": "2026-06-23 12:00:00",
    "beta_to": "2026-07-21 12:00:00",
    "sets": [
        "independence_day_2026_set_1",
        "independence_day_2026_set_2",
        "independence_day_2026_set_3",
        "independence_day_2026_set_4",
        "independence_day_2026_set_5",
        "independence_day_2026_set_6",
        "independence_day_2026_set_7",
        "independence_day_2026_set_8",
        "independence_day_2026_set_9",
        "independence_day_2026_set_10",
        "independence_day_2026_set_11",
        "independence_day_2026_set_12",
        "independence_day_2026_set_13"
    ],
    "items": [54856000, 54857000, 54869000, 54870000, 54882000, 54883000, 54902000],
    "quests": [340],
    "tombola": 59,
    "forum_url": "https://forum.beta.the-west.net/index.php?threads/independence-day-2026.5666/"
}
