{
    "key": "firefighters_sale",
    "name": "Firefighters Sale",
    "items": [51997000, 51998000],
    "sets": ["firefighter_set_1", "firefighter_set_2"],
    "from": "2020-05-29 12:00:00",
    "to": "2020-05-31 12:00:00",
    "year": 2020,
    "forum_url": "https://forum.the-west.net/index.php?threads/firefighters-sale.58737/"
}
