{
    "key": "harvest_sale",
    "name": "Harvest Sale",
    "items": [52133000, 52132000, 52131000],
    "year": 2025,
    "quests": [],
    "from": "2025-08-22 12:00:00",
    "to": "2025-08-24 12:00:00",
    "beta_from": "2025-08-22 09:00:00",
    "beta_to": "2025-08-24 09:00:00",
    "forum_url": "https://forum.beta.the-west.net/index.php?threads/harvest-sale-2025.5249/#post-60101"
}
