{
    "$schema": "https://raw.githubusercontent.com/timzatko/TW-Calc-Website-Events/master/schema.json",
    "name": "Spring Sale",
    "key": "spring_sale",
    "items": [51467000, 51929000, 51930000, 51931000],
    "sets": [
        "community_event_2020_march",
        "community_event_2020_march_2",
        "eire_set_1",
        "eire_set_2",
        "eire_set_3",
        "summer_spirit"
    ],
    "from": "2022-03-30 12:00:00",
    "to": "2022-04-01 12:00:00",
    "beta_from": "2022-03-30 09:00:00",
    "beta_to": "2022-04-01 09:00:00",
    "year": 2022
}
