{
    "key": "winter_event",
    "name": "Winter Event",
    "items": [50368000, 52323000, 52322000],
    "sets": ["set_wrightbrothers", "curling_set_1", "curling_set_2"],
    "from": "2021-02-03 12:00:00",
    "to": "2020-02-12 12:00:00",
    "year": 2021,
    "beta_from": "2020-01-23 12:00:00",
    "beta_to": "2020-02-14 12:00:00",
    "forum_url": "https://forum.beta.the-west.net/index.php?threads/winter-event-2020.3502/"
}
